Rank,Author,Title,Citations,Year,Publisher,Venue,Content,Source,PDF,cit/year
11,"W Ni-Meister, DLB Jupp…",Modeling lidar waveforms in heterogeneous and discrete canopies,346,2002, ieeexplore.ieee.org, … on geoscience and remote …,"… and programming; and remote sensing applications management and … and inland waters 
remote sensing; reef mapping in the Great Barrier Reef of Australia; airborne remote sensing of …",https://ieeexplore.ieee.org/abstract/document/951085/,https://ieeexplore.ieee.org/iel5/36/20570/00951085.pdf,14
8,"ACT Pinheiro, JL Privette, R Mahoney…",Directional effects in a daily AVHRR land surface temperature dataset over Africa,134,2004, ieeexplore.ieee.org, … and Remote Sensing,"… We also ignored small inland water bodies (eg, rivers), human … that a normalized LST climate 
data product (global time series … health applications using remotely sensed satellite data. …",https://ieeexplore.ieee.org/abstract/document/1333179/,https://ieeexplore.ieee.org/iel5/36/29436/01333179.pdf,6
12,"WT Crow, STK Chan, D Entekhabi…",An observing system simulation experiment for Hydros radiometer-only soil moisture products,120,2005, ieeexplore.ieee.org, … and Remote Sensing,"… Prospects for the removal of this bias via a correction strategy for inland … Data Product for 
the Advanced Microwave Scanning Radiometer (AMSR) onboard the NASA EOS Aqua satellite. …",https://ieeexplore.ieee.org/abstract/document/1433027/,https://ieeexplore.ieee.org/iel5/36/30898/01433027.pdf,5
13,"R Romeiser, H Runge, S Suchandt…",Current measurements in rivers by spaceborne along-track InSAR,87,2007, ieeexplore.ieee.org, … and Remote Sensing,"… The availability of satellitebased remote sensing techniques would significantly improve the 
… 1(b) is the InSAR-specific data product that contains explicit information on target velocities. …",https://ieeexplore.ieee.org/abstract/document/4378563/,https://ieeexplore.ieee.org/iel5/36/4378550/04378563.pdf,4
19,"JT Pulliainen, J Grandell…",Retrieval of surface temperature in boreal forest zone from SSM/I data,77,2002, ieeexplore.ieee.org, … Geoscience and Remote …,"… The original SSM/I data product gives the measured brightness temperatures and geodetic 
… from satellite using ground measurements or satellite data,” Int. J. Remote Sensing, vol. 12, …",https://ieeexplore.ieee.org/abstract/document/628786/,https://ieeexplore.ieee.org/iel3/36/13674/00628786.pdf,3
2,"H Carreno-Luengo, CS Ruf",Retrieving freeze/thaw surface state from CYGNSS measurements,51,2021, ieeexplore.ieee.org, … Geoscience and Remote Sensing,"… Detecting highly dynamic F/T transitions at large scales requires spaceborne Remote Sensing 
… thaw characteristics using satellite L-band radar remote sensing,” IEEE Trans. Geosci. …",https://ieeexplore.ieee.org/abstract/document/9576723/,https://ieeexplore.ieee.org/iel7/36/9633014/09576723.pdf,8
18,"E Peral, D Esteban-Fernández…","KaRIn, the Ka-band radar interferometer of the SWOT mission: design and in-flight performance",44,2024, ieeexplore.ieee.org, … and Remote Sensing,"… This particular scene was also selected to illustrate a grid-pattern artifact at the center of the 
image, sometimes observed at coastlines and over calm inland water bodies. This is due to …",https://ieeexplore.ieee.org/abstract/document/10539050/,https://ieeexplore.ieee.org/iel7/36/10354519/10539050.pdf,15
21,"J Winterfeldt, A Andersson, C Klepp…","Comparison of HOAPS, QuikSCAT, and buoy wind speed in the Eastern North Atlantic and the North Sea",38,2009, ieeexplore.ieee.org, … and Remote Sensing,"… both the adjacent coastal and inland regions. Storms over sea … remote sensing data sets, 
namely, QuikSCAT and the Hamburg Ocean Atmosphere Parameters and fluxes from Satellite (…",https://ieeexplore.ieee.org/abstract/document/5232877/,https://ieeexplore.ieee.org/iel5/36/5356243/05232877.pdf,2
